,Title,줄거리,장르,Image,image_name
93,뮤지컬 〈비더슈탄트〉,"1938년 독일, 야심찬 17살 매그너스는 최고의 펜싱 선수가 되기 위해 가장 친한 친구 아벨과 함께 아이드 스포츠 학교에 입학하지만, 학교에 대한 뜻밖의 진실을 알게 된다. 매그너스와 아벨은 펜싱부 친구들과 함께 학교의 비밀을 파헤치고 알리기 시작하면서 그들만의 저항 활동을 시작한다.
한편, 매그너스는 학교의 최고 책임자인 클레어 단장의 관심과 인정을 받으면서 흔들리기 시작하는데...","드라마, 감동",뮤지컬 〈비더슈탄트〉.png,/content/drive/MyDrive/캡스톤/데이터/포스터/뮤지컬 〈비더슈탄트〉.png
94,뮤지컬 〈사칠〉,"#1소방서, 장비계.
의무소방원 시절부터 특급 소방이라 불리며 최강 소방전 지역 예선 2등까지 했지만, 현재는 소방행정과에서 장비계 창고에서 소방 물품을 정리하는 일을 하고 있는 '안정원'은 오늘도 소방물품정리에 여념이 없다. 의무소방시절 후임 '강이준'이 같은 소방서로 발령이 난다. ""소방! 신고합니다. 소방사 강이준은 2016년 7월 21일부로 원척소방서로 배치를 명 받았습니다. 이에 신고합니다. 소방.""","드라마, 감동",뮤지컬 〈사칠〉.gif,/content/drive/MyDrive/캡스톤/데이터/포스터/뮤지컬 〈사칠〉.gif
95,뮤지컬 〈셜록홈즈 : 앤더슨가의 비밀〉,"19세기말 런던 크리스마스 이브.
영국 최고의 명문가 앤더슨가에서 울린
두 발의 총성 그리고 사라진 한 여인!
보름 후, 거액의 사례금과 '셜록 홈즈'의 사무실로
앤더슨가의 세 남자가 찾아온다.
유일한 상속자로 모든 것을 손에 쥔 형 '아담 앤더슨'
1분 차이로 모든 것을 포기해야 했던 그의 쌍둥이 동생 '에릭 앤더슨' 그리고 두 형제의 숙부 '포비 앤더슨'
세 명의 의뢰는 단 하나!
""루시 죤스를 찾아 주시오!""
범죄가 없는 런던에 지루해 하던 셜록은
새로운 사건에 흥분하며 왓슨과 함께 사건을 맡는다.
수사가 시작되자 '앤더슨가 주변의 인물들이
한 명씩 살해되기 시작하는데...","스릴러, 미스터리, 로맨스",뮤지컬 〈셜록홈즈 : 앤더슨가의 비밀〉.png,/content/drive/MyDrive/캡스톤/데이터/포스터/뮤지컬 〈셜록홈즈 : 앤더슨가의 비밀〉.png
96,뮤지컬 〈쇼맨_어느 독재자의 네 번째 대역배우〉,"내가 가장 나다울 수 있는 순간을 향해 이것은 쇼, 한바탕 꿈
2020년 미국 뉴저지 주 어느 소도시. 대형마트 직원으로 하루하루 성실하게 살아가는 한국계 입양아 출신 수아는 유일한 취미인 유원지 구경을 하던 중
회전목마를 타고 나타난 수상한 노인 네불라를 만난다. 수아를 사진작가로 오해한 네불라는 그녀에게 촬영을 의뢰하고, 수아는 대충 찍고 공돈이나 벌 생각에 흔쾌히 의뢰를 받아들인다. 하지만 수아의 예상과 달리 네불라는 진짜 자신의 모습을 남기고 싶다며 혼신의 힘을 다해 지난 인생 역정을 털어놓는다. 그 모습이 부담스럽다 못해 징그럽기까지 한수아는 어쩔 줄을 모르는데... 과연 수아는 극도의 거북함을 무릅쓰고 무사히 촬영을 마칠 수 있을까? 또한 처절하리만큼 인생 사진에 집착하는 네불라의 진짜 속내는 무엇일까?","드라마, 공감/힐링",뮤지컬 〈쇼맨_어느 독재자의 네 번째 대역배우〉.png,/content/drive/MyDrive/캡스톤/데이터/포스터/뮤지컬 〈쇼맨_어느 독재자의 네 번째 대역배우〉.png
97,뮤지컬 〈스모크〉,"""바다는 정말 신기하네요. 어떻게 아무리 추워도 얼지 않아요? 강은 추우면 얼어버리는데....""
'한없이 넓고 깊으니까...끝없는 생명이 나오는 거 아닐까요? 절대로 얻거나 멈추지 않죠."" 바다를 향한 꿈으로 가득한 해는 나쁜 짓인 줄 알면서도 홍을 납치하려는 초에게 동조한다. 하지만 해는 초가 몸값을 얻어내기 위한 전보를 치러 나간 사이에 기침으로 괴로워하는홍을 풀어주고, 홍은 해에게 다가간다. ""나... 모르겠어?' 갇힌 공간 두 남자와 한 여자. 이들은 과연 어떤 비밀을 가지고 있는 걸까.",드라마,뮤지컬 〈스모크〉.png,/content/drive/MyDrive/캡스톤/데이터/포스터/뮤지컬 〈스모크〉.png
98,뮤지컬 〈스토리오브마이라이프〉,"""바다는 정말 신기하네요. 어떻게 아무리 추워도 얼지 않아요? 강은 추우면 얼어버리는데....""
'한없이 넓고 깊으니까...끝없는 생명이 나오는 거 아닐까요? 절대로 얻거나 멈추지 않죠."" 바다를 향한 꿈으로 가득한 해는 나쁜 짓인 줄 알면서도 홍을 납치하려는 초에게 동조한다. 하지만 해는 초가 몸값을 얻어내기 위한 전보를 치러 나간 사이에 기침으로 괴로워하는홍을 풀어주고, 홍은 해에게 다가간다. ""나... 모르겠어?' 갇힌 공간 두 남자와 한 여자. 이들은 과연 어떤 비밀을 가지고 있는 걸까.","드라마, 감동 ",뮤지컬 〈스토리오브마이라이프〉.png,/content/drive/MyDrive/캡스톤/데이터/포스터/뮤지컬 〈스토리오브마이라이프〉.png
99,뮤지컬 〈삼총사〉,"17세기 프랑스, 가스코뉴 출신의 달타냥은 총사가 되기 위해 파리로 온다.
파리의 아름다운 거리에 감탄하던 달타냥은 소매치기를 당하고, 이를 잡으려다 세 명의 총사와 마주친다. 이들은 다름아닌 유명한 삼총사 아토스, 아라미스, 포르토스! 달타냥을 시골뜨기라 비웃는 삼총사와 겁 없는 가스코뉴 청년 달타냥은 명예를 건 결투를 약속한다. 정오를 알리는 시계탑 종소리가 울리고 마침내 달타냥과 삼총사는 결투를 시작하려는데, 돌연 붉은 망토의 사나이들이 나타난다. 이들은 파리 최고의 권력가 리슐리외 추기경의 근위병들이다. 삼총사는 이들과 시비 끝에 결투를 하게 되고, 달타냥은 삼총사와 하나가 되어 통쾌한 승리를 거둔다. 승리를 자축하며 한바탕 술판을 벌이는 달타냥과 삼총사. 달타냥은 그곳에서 마주친 천사 같은 여인 콘스탄스와 사랑에 빠진다. 하지만 술판이 무르익어갈 무렵, 어디선가 날카로운 비명소리가 들리고 콘스탄스는 의문의 납치를 당하게 된다. 달타냥과 삼총사는 납치범이 리슐리외 추기경의 여간첩 밀라디임을 알게되고 힘을 합쳐 리슐리외 추기경의 음모를 밝혀내기로 결의한다. 한편, 왕실에서는 일주일 후 열리는 왕의 탄신일 준비로 분주하다. 하지만 왕은 행방불명되고, 달타냥과 삼총사에게는 예기치 못한 음모가 기다리고 있는데......","역사극, 액션,  코믹",뮤지컬 〈삼총사〉.png,/content/drive/MyDrive/캡스톤/데이터/포스터/뮤지컬 〈삼총사〉.png
100,뮤지컬 〈오페라의 유령〉 - 서울,"거부할수없는 강렬한 이끌림 가면속에 감춰진 아름다운 러브스토리
파리 오페라 하우스 무명 무용수였던 크리스틴은 우연히 새로운 공연의 주인공으로 발탁되고 그녀의 아름다운 노랫소리는 모두를 매료시키며 최고의 프리마돈나로 급부상한다
유령의 초대, 그리고 경고 분장실에 홀로 있던 크리스틴은 흰 마스크로 얼굴을 숨긴 채 나타난 유령에게 이끌려 지하미궁으로 사라진다. 크리스틴의 실종으로 혼란에 빠진 오페라하우스에는 유령의 경고장이 한장씩 도착한다.
거부할 수 없는 운명 다시 돌아온 크리스틴,
하지만 지하미궁 유령의 은신처에서 그의 정체를 알게 된 크리스틴은 공포에 사로잡히고 그녀를사랑하는귀족 청년 라울은 사랑을 맹세하며 크리스틴을 유령에게서 구해내기 위해 계획을 세우는데.....","드라마, 로맨스, 감동",뮤지컬 〈오페라의 유령〉 - 서울.gif,/content/drive/MyDrive/캡스톤/데이터/포스터/뮤지컬 〈오페라의 유령〉 - 서울.gif
101,뮤지컬 〈위윌락유〉,"전설의 기타를 뽑아들고 달릴거야! 널 다시 만날때까지!
2223년의 지구는 픽셀 휴먼 킬러퀸의 지배를 받으며 아이플래닛이라고 불리게 된다. 모든 인간은 슈퍼컴퓨터에 의해 정해진 인생만을 살아야 하고 이를 따르지 않을 경우 사살된다는 악법의 세상 속에서 사랑과 음악, 선택의 자유를 빼앗긴 인간들은 분노하기 시작한다.
아이플래닛에 대항하는 혁명군, 보헤미안들의 대장 갈릴레오는 스카라무슈와 함께 아이플래닛의 슈퍼컴퓨터를 폭파하기 위해 그들의 심장부로 잠입했다가 총사령관 카쇼기의 공격에 의해 스카라무슈를 잃게 되고 슬픔에 빠진
갈릴레오는 이 우주의 또 다른 시간 어디에선가 살아있을 그녀를 찾기 위해 전설의 기타를 뽑아들고 200년 전의 과거로 들어서는데... 과연, 갈릴레오는 과거의 시간 속에서 스카라무슈를 다시 만나 사랑을 이루고 2223년의 지구를 킬러퀸으로부터 구해낼 수 있을까?
","드라마, 코믹",뮤지컬 〈위윌락유〉.png,/content/drive/MyDrive/캡스톤/데이터/포스터/뮤지컬 〈위윌락유〉.png
102,뮤지컬 〈이토록 보통의〉,"우주비행사를 꿈꾸는 '제이'와 그녀를 사랑하는 '은기'
여느 때와 다름없는 '보통' 일상을 보내던 어느 날,
""나 드디어 우주로 발령받았어!!!""
오랜 꿈을 이루게 되어 기쁜 제이와
통보를 받아들일 수 없는 은기.
그들의 관계는 혼란스러워지기 시작하는데...
","드라마, 감동, 로맨스",뮤지컬 〈이토록 보통의〉.png,/content/drive/MyDrive/캡스톤/데이터/포스터/뮤지컬 〈이토록 보통의〉.png
103,뮤지컬 〈인사이드 윌리엄〉 2023,"세계적인 명작 탄생을 꿈꾸며 「명작, 이대로만 하면 쓸 수 있다!」의 지침에 따라 아버지의 복수에 성공하는 왕자 햄릿과 가문의 반대를 극복하고 사랑을 이루는 「로미오와 줄리엣을 집필 중인 셰익스피어
원고속에 직접 뛰어들어 흥미진진하게 이야기를 진행시키던 중 불어오는 거센 바람 때문에 두 원고는 뒤섞이고, 캐릭터들은 원고 밖으로 빠져나오게 되는데... 복수보다는 시를 쓰고 싶은 햄릿
사랑보다는 칼이 더 좋은 줄리엣 장르불문 무조건 주인공이 되고 싶은 로미오 어떻게든 캐릭터들을 제자리로 되돌려 명작을 탄생시키려는 셰익스피어
과연 그들은 자신만의 파라다이스를 찾을수 있을까?","드라마, 공감/힐링",뮤지컬 〈인사이드 윌리엄〉 2023.png,/content/drive/MyDrive/캡스톤/데이터/포스터/뮤지컬 〈인사이드 윌리엄〉 2023.png
104,뮤지컬 〈칠칠〉,"그림으로 먹고 사는 직업 화가, 조선 최초의 환쟁이 최북. 최북은 '최산수'라 불리며 산수화의 달인으로 이름을 높이지만 자신의 그림을 물에 담그거나, 판매한 그림을 찢는 기행을 일삼는다. 그의 기행에 사람들은 점점 그를 떠나가지만 유일한 친구 무명만은 그의 곁을 지킨다. 어느 날, 북은 자신의 대표작을 그리기 위해 무명과 금강산으로 떠나고 그곳에서 외면했던 과거를 돌아보게 된다. 마침내 자신의 혼을 넣은 그림을 완성하고 한양으로 돌아온 날, 세도가 원준이 그림을 사기 위해 최북과 무명을 찾아온다. 얼굴을 가린 발 앞에 앉아 그림을 보던 원준은 그림에 대한 답례라며 이야기 하나를 시작하는데....","드라마, 공감/힐링",뮤지컬 〈칠칠〉.png,/content/drive/MyDrive/캡스톤/데이터/포스터/뮤지컬 〈칠칠〉.png
105,뮤지컬 〈컴프롬어웨이〉,"2001년 9월 11일.
전 세계가 혼란과 절망에 빠진 그때, 미국으로 향하던 38대의 비행기가 캐나다의 작은 도시 갠더로 불시착한다. 승객들은 영문도 모른 채 불안에 떨고, 비행기 안은 정체 모를 소문만 무성하다. 그리고, 갠더 주민들은 혼란에 빠져 있을 새도 없이 어느 날 갑자기 자신들의 인구만큼이나 많은 이방인들을 맞이해야만 하는 상황에 맞닥뜨린다. 작은 마을의 시장. 오늘 처음 출근한 신입 리포터. 시위 중이던 지역 버스 운전사 노조위원장. 컨퍼런스로 향하던 직장인. 매일 두 번의 기도를 올려야 하는 무슬림 동물들에 대한 걱정이 최우선인 동물학대방지협회 대표. 소방관 아들을 둔 엄마. 휴가를 떠나던 커플.  비행기 기장
인종도, 고향도, 언어도, 취향도, 성격도 모두 다른 이들이, 작은 땅 갠더에서 서로를 이해할 수 있을까..?","드라마, 감동",뮤지컬 〈컴프롬어웨이〉.png,/content/drive/MyDrive/캡스톤/데이터/포스터/뮤지컬 〈컴프롬어웨이〉.png
106,뮤지컬 〈킴즈〉,"다정한 심리학자 아빠 게이브, 잘나가는 영화감독 엄마 에이미, 인플루언서 대학생인 딸 메리, 천재 게임 개발자 아들 에릭까지. 이 4인 가족은 그야말로 이상적이고 화목한 '완벽한 가족'이다. 어느날 갑자기 완벽해보이는 이들의 은밀한 사생활이 폭로되고 그들을 둘러싼 모든 상황이 달라져 버린다!
가족들은 불행의 원인을 서로에게 찾으며 서로 물고 헐뜯으며 파멸 직전까지 가는 그 순간! 온 세상이 파랗게 변하고 그들의 눈 앞에 알 수 없는 코드문자들이 쏟아지기 시작하는데....!","코믹, 감동",뮤지컬 〈킴즈〉.gif,/content/drive/MyDrive/캡스톤/데이터/포스터/뮤지컬 〈킴즈〉.gif
107,뮤지컬 〈타오르는 어둠 속에서〉,"장애를 잊고 자유롭고 평화롭게 살아가는 '돈 파블로 맹인학교의 학생들
그들 중 리더인 까를로스와 후아나는 모두의 부러움을 사는 우등생 커플이다. 개학 첫날, 그들만의 완전한 세상에 염세적이고 비관적인 태도의 '이그나시오'가 입학한다. 이후 이그나시오의 존재로 인해 학생들은 조금씩 자신들의 장애를 인식하고 자신감을 잃어간다. 까를로스와 후아나는 이를 바로 잡기 위해서 나서지만 학교는 점점 더 혼란에 빠지게 되는데..","드라마, 감동",뮤지컬 〈타오르는 어둠 속에서〉.png,/content/drive/MyDrive/캡스톤/데이터/포스터/뮤지컬 〈타오르는 어둠 속에서〉.png
108,뮤지컬 〈판〉,"19세기 말 조선. 서민들 사이에서 흉흉한 세상을 풍자하는 패관소설들이 퍼지자 세책가를 중심으로 소설들을 모두 거둬 불태워버리라는 명령이 떨어진다. 과거시험에는 별 다른 관심이 없던 부잣집 도련님 달수는 어느 날 세책가 앞에서 우연히 보게 된 이덕에 반해 한 매설방 앞에 당도하게 된다.
시대를 읽는 눈을 가진 밝은 여성, 춘섬이 운영하는 매설방에서 이덕은 이야기를 읽는 전기수를 위한 소설을 필사하고 있다. 달수는 그곳에서 조선의 여인들을 이야기로 홀린 희대의 전기수 호태를 만나 금지된 이야기의 맛에 서서히 빠져들고, 급기야 호태를 따라다니며 '낭독의 기술까지 전수받게 되는데...","코믹, 블랙코미디, 감동",뮤지컬 〈판〉.png,/content/drive/MyDrive/캡스톤/데이터/포스터/뮤지컬 〈판〉.png
109,뮤지컬 〈프리다〉,"인생은 무엇일까? 죽음은 무엇일까? 산다는 것과 죽는다는 것의 경계에서 이 쇼는 시작된다.
THE LAST NIGHT SHOW
오늘의 주인공으로 소개되는 이는 멕시코 화가 프리다 칼로! 세 명의 크루들과 함께 들려주는 그녀의 삶. 인생 변곡점의 순간마다 그녀가 어떤 선택을 했는지에 대한 이야기를 따라가다 보면 우리는 이 쇼가 그냥 평범한 쇼가 아님을 알게 된다. 인생의 마지막 날. 눈을 감기 전 펼쳐진다는 파노라마가 이 쇼의 진짜 이야기였다는 것을 알게 된 순간 그녀의 심장은 멈춘다. 그리고 비로소 시작된다. 신체적 고통과 정신적 고통, 그 모든 것을 그림과 예술, 위트로 승화시킨 그녀의 진짜 쇼가 말이다.",드라마,뮤지컬 〈프리다〉.gif,/content/drive/MyDrive/캡스톤/데이터/포스터/뮤지컬 〈프리다〉.gif
110,뮤지컬 〈후크〉,"런던에서 공장을 운영하는 공장장 제임스.
제임스는 어린 시절 형 데이비드가 실종된 후로 자신을 데이비드라 부르는 미쳐버린 어머니와 밤마다 이상한 놀이를 하며 살아간다. 그러던 어느 날, 어머니가 사라져버리고... 뒤틀려버린 현실로부터 도망가고 싶은 제임스 귓가에 모든 걸 잊어도 된다는 속삭임이 들려온다. 제임스는 어머니의 자취를 따라, 그리고 그 소리를 따라 네버랜드에 도착하고, 그곳에서 만난 피터팬과 웬디의 이야기 놀이에 빠져 현실을 잠시 잊고 네버랜드의 후크가 되어 가는데....",판타지,뮤지컬 〈후크〉.png,/content/drive/MyDrive/캡스톤/데이터/포스터/뮤지컬 〈후크〉.png
111,뮤지컬 드라큘라 (Dracula：The Musical),"빅토리아 시대가 끝나갈 무렵 유럽, 트란실바니아의 영주 드라큘라는 이주를 위해 영국의 토지를 매입하고자하고이 일을 위임받은 젊은 변호사 조나단과 그의 약혼녀 미나는 드라큘라의 초청으로 그의 불가사의한 성에 도착한다. 미나를 마주한 드라큘라는 그녀가 오랫동안 기다려 온 사랑이라는 것을 확신하고, 미나는 드라큘라에게 거부할 수 없는 운명적 이끌림을 느낀다. 한편, 미나의 절친한 친구인 루시는 드라큘라를 만난 뒤로부터 알 수 없는 병으로 앓게 되고 저명한 학자인 반 헬싱 교수는 루시를 보자마자 자신이 오랜 시간동안 연구해 온 뱀파이어의 존재를 직감하고 드라큘라를 추적하기 시작하는데...","로맨스, 판타지",뮤지컬 드라큘라 (Dracula：The Musical).png,/content/drive/MyDrive/캡스톤/데이터/포스터/뮤지컬 드라큘라 (Dracula：The Musical).png
112,뮤지컬 〈블랙메리포핀스〉,"1926년, 독일의 저명한 심리학자 그라첸 슈워츠 박사 대저택 화재 사건!
화재로 인해 대저택은 물론 시체마저 훼손되어 흔적도 남지 않은 이 사건은
세간에 널리 알려지며 강렬한 인상으로 각인된다.
박사의 연구조교이자 입양된 네 아이들의 보모였던 메리 슈미트가 아이들을 극적으로 구출하고 전신화상을 입은 채 사라졌기 때문이다. 화재사건 다음날, 메리는 병원에서 실종되어 수배령이 떨어졌고, 아이들은 화재 당시 있었던 일에 대해 아무것도 기억하지 못했다. 그렇게 사건은 미제 사건으로 일단락되는듯했다. 12년이 지나 사건은 사람들의 기억 속에서 서서히 사라졌고, 네 명의 아이들도 각기 다른 집에 입양돼 새로운 삶을 살아가고 있었다.
담당 형사였던 발터가 죽기 직전, 그라첸 박사의 비밀수첩을 한스에게 건네기 전까지는... 다시 7년이 지난 1945년 절대 끝나지 않을 것 같았던 나치 정권의 붕괴 후, 어느 서점 2층의 작은방. 이 방에서 심리학계를 넘어 전후 상처받은 사회 전반에 큰 반향을 일으키는 사건이 벌어진다. 한때는 메리 슈미트의 연구실이었고 이제는 안나 레아의 연구실이 된 그 방에서 네 명의 아이들은 스스로 의자에 앉아 무의식 속 기억의 방문을 연다. 그리고 그 오래되고 작은 방 속에 갇혀 있던 자신들의 이름을 꺼내어 기어이 삶을 증명한다.","미스터리, 감동",뮤지컬 〈블랙메리포핀스〉.png,/content/drive/MyDrive/캡스톤/데이터/포스터/뮤지컬 〈블랙메리포핀스〉.png
113,뮤지컬 ＇벤허＇,"서기 21년, 제정 로마의 박해에 신음하는 예루살렘, 명망 높은 유대의 귀족 벤허는 로마의 장교가 되어 돌아온 친구 메셀라와 오랜만에 재회한다.
숱한 전쟁을 겪으며 살아남은 메셀라는 벤허에게 유대의 폭도 소탕을 도와달라 부탁하지만, 벤허는 이를 거절한다. 다음 날, 벤허의 여동생 티르자는 집 옥상에서 그라투스 총독의 행군을 구경하다 기왓장을 떨어뜨리는 사고를 낸다. 메셀라는 이를 문제삼아 벤허 가문 전체에 반역죄를 씌운다. 억울한 누명을 쓴 벤허는 로마 군함의 노를 젓는 노예가 된다. 3년 후, 벤허가 탄 군함이 해적과의 전투 중 난파되고, 사령관 퀸터스의 목숨을 구한 벤허는 자유의 신분을 얻어 로마의 귀족이 된다. 생사의 위기를 극복한 벤허는 자신의 모든 것을 앗아간 메셀라에게 복수할 것을 결심한다. 한편, 예루살렘은 나사렛에서부터 유대의 새로운 왕이 온다는 소문으로 술렁이고, 마침내 고향으로 돌아온 벤허는 메셀라에 맞서 전차경주장의 출발선 앞에 나란히 서게 되는데...
","드라마, 역사극, 액션",뮤지컬 ＇벤허＇.png,/content/drive/MyDrive/캡스톤/데이터/포스터/뮤지컬 ＇벤허＇.png
114,어른이 뮤지컬 〈난쟁이들〉,"왕자와 공주들의 아름다운 사랑이 이루어지는 동화나라!
그곳 난쟁이 마을에 난쟁이 찰리와 빅이 살고 있다. 그들은 매일 광산에서 하루 종일 보석을 캐지만 아무리 열심히 벌어봤자 답답한 현실에서 벗어날 기미가 보이지 않는다. 그러던 어느 날, 동화나라에 무도회가 열린다는 공고가 난다. 오랜 전통대로 무도회에서 진실한 키스를 하는 커플이 새로운 동화의 주인공이 된다는 소식은 인생역전의 기회만 노리던 찰리의 심장을 뛰게 한다. 그는 빅과 함께 재투성이 신데렐라를 공주로 만들어 준 마녀 할머니를 찾아가 왕자를 만들어달라고 하지만 마녀는 이젠 개천에서 용나던 시절은 지났다며 마법도 소용없다고 말한다. 하지만 찰리와 빅은 포기하지 않고 급기야 마녀와 거래를 하게 되는데...
","로맨스, 코믹",어른이 뮤지컬 〈난쟁이들〉.png,/content/drive/MyDrive/캡스톤/데이터/포스터/어른이 뮤지컬 〈난쟁이들〉.png
115,이은결 ［더 일루션 - 마스터피스］,"[더 일루션]은 그동안 마술영역에서 볼 수 없었던 하나의 주제의식을 담은 작가주의를 탄생시킨 평가를 받으며 매직이라는 장르 최초로 국립극장과 예술의전당 단독공연에 이어 지난해 LG아트센터 서울의 개관작으로 초청되는 등 작품성과 대중성을 동시에 인정받은 전 세계 유일무이한 작품이다.
[더 일루션]의 다이내믹한 구성과 이은결의 퍼포먼스는 국내 뿐만이 아닌 세계적으로 이미 ""마술계 탑클래스로 인정 받았으며 2018년 전세계 50여개국 2,300명의 마술인들이 참여한 가장 권위 있는 국제 매직콩클 피즘(F.I.S.M)에서 단독 오프닝 공연을 장식하여 업계의 전문가와 마니아들에게 두 번의 전석 기립박수를 받으며 극찬과 찬사가 쏟아진바 있다. [더 일루션-마스터피스]는 이렇게 12년 넘게 한 작품만을 세공한 일루셔니스트 이은결의 서사를 완결하기 위한 완성작이다. 특히 전 세계 최초로 시도된 하나의 장면을 연출하기 위해 지난 1년간 라스베거스 최정상 기술팀과의 협업으로 작품의 마지막 퍼즐을 완성하였다.","마술, 판타지",이은결 ［더 일루션 - 마스터피스］.gif,/content/drive/MyDrive/캡스톤/데이터/포스터/이은결 ［더 일루션 - 마스터피스］.gif
